"Title","Journal","Publication_year","Publication_year.2","statistical.analysis.and.or.simulations","bioinformatic.analysis","additional.comment.on.analysis","analysis_software_names","num.software.calculated","num.software_with_version","num.packages","num.packages_with_version","CodeShared","CodeShared.2","LinktoCode","LocationShared","Repository","FreeSoftware","FreeSoftware.2","DataUsed","DataShared","DataShared.2","ExtraComments","CommentonComments","Screener"
"Host nutritional status mediates degree of parasitoid virulence","OIKOS",2016,"2015-2016","yes","no","ANCOVAs, GLMs, Kruskal-Wallis, Chi-squared tests","R",1,"1","NA","NA","no","no","NA","NA","NA","yes","yes","yes","yes","yes","data at https://datadryad.org/stash/dataset/doi:10.5061/dryad.7fq4j","NA","MP, AB"
"How phylogeny shapes the taxonomic and functional structure of plant-insect networks","OECOLOGIA",2016,"2015-2016","yes","yes","Univariate and multivariate statistics of the phylogenetic signal (PS); modeling cophylogenetic network structure","R",1,"1","3","1","no","no","NA","NA","NA","yes","yes","yes","partially","yes","limited data in supplements (word docs)","NA","MP, AB"
"Human-Imposed, Fine-Grained Patch Burning Explains the Population Stability of a Fire-Sensitive Conifer in a Frequently Burnt Northern Australia Savanna","ECOSYSTEMS",2016,"2015-2016","yes","no","LM and GLMs, LMMs","R",1,"1","2","2","yes","yes","https://link.springer.com/article/10.1007/s10021-016-9973-2","supplementary material","NA","yes","yes","yes","yes","yes","https://www.researchgate.net/publication/286935056_Callitris_intratropica_demography_Arnhem_Land","NA","MP, AB"
"Idiosyncratic responses of Amazonian birds to primary forest disturbance","OECOLOGIA",2016,"2015-2016","yes","no","Random forest","R",1,"1","1","0","no","no","NA","NA","NA","yes","yes","yes","partially","yes","limited data in supplements (word docs) + from Fig","NA","MP, AB"
"Individual parameters shape foraging activity in breeding king penguins","BEHAVIORAL ECOLOGY",2016,"2015-2016","yes","no","LMMs, GLM, LM","R",1,"1","1","0","no","no","NA","NA","NA","yes","yes","yes","no","no","limited data from Figs","NA","MP, AB"
"Individual variation in functional response parameters is explained by body size but not by behavioural types in a poeciliid fish","OECOLOGIA",2016,"2015-2016","yes","no","logistic polynomial regression, Random Predation model, nonlinear least square regression, parametric bootstrapping, PCA, Bartlett test, KMO test, LME, likelihood ratio tests, linear regression models","R",1,"1","4","3","no","no","NA","NA","NA","yes","yes","yes","no","no","limited data from Figs","NA","MP, AB"
"Information from familiar and related conspecifics affects foraging in a solitary wolf spider","OECOLOGIA",2016,"2015-2016","yes","no","t-test, REML, ANOVAs, Poisson regression, Tukey's HSD,","JMP",1,"1","NA","NA","no","no","NA","NA","NA","no","no","yes","no","no","limited data from Figs","NA","MP, AB"
"Interactive effects of fire and large herbivores on web-building spiders","OECOLOGIA",2015,"2015-2016","yes","no","generalised multi-level path analysis, GLMM, LMM, canonical correspondence analysis, permutation test","R",1,"0","NA","NA","no","no","NA","NA","NA","yes","yes","yes","no","no","NA","NA","AC, AB"
"Interactive effects of understory removal and fertilization on soil respiration in subtropical Eucalyptus plantations","JOURNAL OF PLANT ECOLOGY",2015,"2015-2016","yes","no","ANOVAs, Mixed Models","SPSS",1,"1","NA","NA","no","no","NA","NA","NA","no","no","yes","no","no","limited data from Figs","NA","MP, AB"
"Interference competition: odours of an apex predator and conspecifics influence resource acquisition by red foxes","OECOLOGIA",2015,"2015-2016","yes","no","GLMM, Fishers LSD, LM,","R",1,"0","0","NA","no","no","NA","NA","NA","yes","yes","yes","no","no","NA","NA","AC, AB"
"Is the positive relationship between species richness and shoot morphological plasticity mediated by ramet density or is there a direct link?","OECOLOGIA",2015,"2015-2016","yes","no","ANOVA, Mixed Models, mixed general linear model, a path analysis using maximum likelihood method","Statistica and SAS and R",3,"3","1","0","no","no","NA","NA","NA","partially","yes","yes","no","no","NA","NA","MP, AB"
"Land sparing is crucial for urban ecosystem services","FRONTIERS IN ECOLOGY AND THE ENVIRONMENT",2015,"2015-2016","yes","no","GLMs","R",1,"0","NA","NA","no","no","NA","NA","NA","yes","yes","yes","partially","yes","limited information on data in SI https://esajournals.onlinelibrary.wiley.com/action/downloadSupplement?doi=10.1890%2F140286&file=Gaston_WEB_ONLY.pdf","NA","MP, AB"
"Landscape Control on the Spatial and Temporal Variability of Chromophoric Dissolved Organic Matter and Dissolved Organic Carbon in Large African Rivers","ECOSYSTEMS",2015,"2015-2016","yes","no","Descriptive statistics, correlation analysis","Not Stated",NA,"NA","NA","NA","no","no","NA","NA","NA","NA","NA","yes","yes","yes","SI https://link.springer.com/article/10.1007/s10021-015-9894-5","NA","MP, AB"
"Leaf-litter breakdown in streams of East Malaysia (Borneo) along an altitudinal gradient: initial nitrogen content of litter limits shredder feeding","FRESHWATER SCIENCE",2015,"2015-2016","yes","no","PCA, ANCOVA, Tukey’s post hoc","Not Stated",NA,"NA","NA","NA","no","no","NA","NA","NA","NA","NA","yes","no","no","NA","NA","AC, AB"
"Local controls on sediment accumulation and distribution in a fjord in the West Antarctic Peninsula: implications for palaeoenvironmental interpretations","POLAR RESEARCH",2016,"2015-2016","yes","no","NA","Not Stated",NA,"NA","NA","NA","no","no","NA","NA","NA","NA","NA","yes","partially","yes","SI https://polarresearch.net/index.php/polar/article/view/3263","NA","MP, AB"
"Maintained functional diversity in benthic communities in spite of diverging functional identities","OIKOS",2016,"2015-2016","yes","no","Assessing fuctional diversity, linear mixed effect model, PERMANOVA, pair-wise tests","R",1,"1","3","3","no","no","NA","NA","NA","yes","yes","yes","yes","yes","http://dx.doi.org/10.5061/dryad.6hc8q","NA","MP, AB"
"Mapping ecosystem services potential in Lithuania","INTERNATIONAL JOURNAL OF SUSTAINABLE DEVELOPMENT AND WORLD ECOLOGY",2016,"2015-2016","yes","no","Spearman's correlations, PCA","Statistica",1,"1","NA","NA","no","no","NA","NA","NA","no","no","yes","yes","yes","CLC2006 based on the CORINE programme from EC","NA","MP, AB"
"Measuring and managing resistance and resilience under climate change in northern Great Lake forests (USA)","LANDSCAPE ECOLOGY",2016,"2015-2016","yes","no","Used LANDIS-II v6.0 landscape model to simulate forest change with extentions regarding biomass succession and harvest + base fire and wind; diversity analysis using R (Fdis and Bray-Curtis dissimilarity)","LANDIS-II and R",2,"1","3","2","no","no","NA","NA","NA","yes","yes","yes","partially","yes","data from literature: monthly PRISM climate data (Daly and Gibson 2002); monthly downscaled temperature and precipitation projections through the USGS data portal http://cida.usgs.gov/
 climate/gdp/ (Stoner et al. 2012); the IPCC
 climate projections climate data to year 2100","NA","MP, AB"
"Mechanisms driving diversity-productivity relationships differ between exotic and native communities and are affected by gastropod herbivory","OECOLOGIA",2016,"2015-2016","yes","no","Linear mixed models, mixed model","SAS",1,"1","NA","NA","no","no","NA","NA","NA","no","no","yes","no","no","limited data from Figs","NA","MP, AB"
"Model-based Evidence for Cyclic Phenomena in a High-Elevation, Two-Species Forest","ECOSYSTEMS",2016,"2015-2016","yes","no","Used the University of Virginia Forest Model Enhanced(UVAFME); an extension of the individual-based gap model FAREAST (Yan andShugart2005) for simulating forest data","UVAFME",1,"0","NA","NA","no","no","NA","NA","NA","yes","yes","yes","yes","yes","model parameters in the main text; data on species composition, climate, and site and soil parameters from the SNOTEL Network (NRCS 2014) and the US Forest Service. Daily precipitation
 and temperature conditions in UVAFME are derived from statistical distributions of mean monthly precipitation and temperature from 24 years of weather station data from the site for the period of
 1989 to 2013 (NRCS 2014).","NA","MP, AB"
"Modeling rates of life form cover change in burned and unburned alpine heathland subject to experimental warming (vol 178, pg 615, 2015)","OECOLOGIA",2015,"2015-2016","yes","no","GLMs, multi-level models, bayesian inference, regression coeficients based on Cauchy distribution, Monte Carlo sampling","R and JAGS",2,"2","1","1","yes","yes","https://link.springer.com/article/10.1007/s00442-015-3261-2","supplementary material","NA","yes","yes","yes","no","no","NA","NA","MP, AB"
"Modeling the risk of livestock depredation by jaguar along the Transamazon highway, Brazil","BASIC AND APPLIED ECOLOGY",2015,"2015-2016","yes","no","Spatial modeling of depredation risk, ecological niche factor analysis, maximum entropy, model evaluation using area under the curve (AUC)","Open Modeller and BioMapper and Maxent",3,"3","NA","NA","no","no","NA","NA","NA","yes","yes","yes","yes","yes","environmental layers to characterize attack sites (http://www.dpi.inpe. br/Ambdata/), distance to forests and to deforested areas (km, http://www.obt.inpe.br/prodes/index.php), distance to roads (km, http://siscom.ibama.gov.br/
 mapas/Novo Flex/), distance to settlements (km,
 http://downloads.ibge.gov.br/downloads geociencias.htm)
 and cattle density (number of animals/km, http://www.
 sidra.ibge.gov.br)","NA","MP, AB"
"Mosquitofish predation and aquatic vegetation determine emergence patterns of dragonfly assemblages","FRESHWATER SCIENCE",2016,"2015-2016","yes","no","ANOVA, ANCOVA, Chi-square, Tukey HSD, Pairwise similarity indices, ANOSIM, cluster analysis (NMDS), permutation analysis","SPSS and R and Primer and PERMDISP",4,"4","NA","NA","no","no","NA","NA","NA","partially","yes","yes","no","no","limited data from Figs","NA","MP, AB"
"Mother knows the best mould: an essential role for non-wood dietary components in the life cycle of a saproxylic scarab beetle","OECOLOGIA",2016,"2015-2016","yes","no","unclear use of 'we modelled'","SAS",1,"1","NA","NA","no","no","NA","NA","NA","no","no","yes","no","no","NA","NA","AC, AB"
"Multi-scale habitat selection modeling: a review and outlook","LANDSCAPE ECOLOGY",2016,"2015-2016","yes","no","polythetic hierarchical agglomerativeclustering (PAHC) analysis","R",1,"0","NA","NA","no","no","NA","NA","NA","yes","yes","yes","yes","yes","https://link.springer.com/article/10.1007/s10980-016-0374-x#Sec11. data is shared under the name of Supplementary material 1 (no specific indication that this is data), and this dataset has to be slightly modified for the analysis","NA","AC, AB"
"Multi-scale network analysis shows scale-dependency of significance of individual protected areas for connectivity","LANDSCAPE ECOLOGY",2016,"2015-2016","yes","no","network analysis, Kolomogorov-Smirnov test, Pearson's correlations, Erdos-Renyi algorithm, eigenvector centrality, network density, node removal technique, regression analysis","R",1,"0","1","1","no","no","NA","NA","NA","yes","yes","yes","yes","yes","the South African National Land CoverDataset (NLCD); Cape fynbos endemic birds that play an important pollinating role in the fynbos biome in the Western Cape of South Africa (Birdlife International 2010, Endemic Bird Area factsheet: Cape fynbos. Downloaded from 450 http://www.birdlife.org)","NA","MP, AB"
"Multi-scale prediction of landscape resistance for tiger dispersal in central India","LANDSCAPE ECOLOGY",2016,"2015-2016","yes","no","Conditional logistic regression","Not Stated",NA,"NA","NA","NA","no","no","NA","NA","NA","NA","NA","yes","no","no","NA","NA","AST, AB"
"Nest-dwelling ectoparasites reduce antioxidant defences in females and nestlings of a passerine: a field experiment","OECOLOGIA",2015,"2015-2016","yes","no","Mann-Whitney U-test, GLMs, t-test, Partial Eta Squared","Statistica and GPower",2,"2","NA","NA","no","no","NA","NA","NA","partially","yes","yes","no","no","NA","NA","MP, AB"
"Niche segregation between immature and adult seabirds: does progressive maturation play a role?","BEHAVIORAL ECOLOGY",2016,"2015-2016","yes","no","GLMs, likelihood ratio tests","R",1,"0","NA","NA","no","no","NA","NA","NA","yes","yes","yes","no","no","NA","NA","MP, AB"
"Niche-based host extinction increases prevalence of an environmentally acquired pathogen","OIKOS",2016,"2015-2016","yes","no","the quantitative framework proposed
 by Ulrich and Gotell (test for non-randomness), Z-test, GLMs, Kolgomorov-Smirnov's test","R and Turnover",2,"0","NA","NA","no","no","NA","NA","NA","partially","yes","yes","no","no","link for software Turnover <www.keib.umk.pl/> is not working","NA","MP, AB"
"Not leaving home: grandmothers and male dispersal in a duolocal human society","BEHAVIORAL ECOLOGY",2016,"2015-2016","yes","no","event history analysis (EHA), relogit regression, Mann-Whitney U-test, chi-square test","STATA and SPSS",2,"2","NA","NA","no","no","NA","NA","NA","no","no","yes","partially","yes","limited data from Figs and Tables","NA","MP, AB"
"Optimal age of maturity in fluctuating environments under r- and K-selection","OIKOS",2016,"2015-2016","yes","no","NA","Not Stated",NA,"NA","NA","NA","no","no","NA","NA","NA","NA","NA","no","NA","NA","used simulations","NA","MP, AB"
"Organic-matter decomposition along a temperature gradient in a forested headwater stream","FRESHWATER SCIENCE",2016,"2015-2016","yes","no","repeated measures(rm) ANCOVA, 2-way ANCOVA, 2-way rmANCOVAs, 1-way rmANCOVA, Pearson's correlation, regression analyisis","SYSTAT",1,"1","NA","NA","no","no","NA","NA","NA","no","no","yes","no","no","limited data from Figs","NA","MP, AB"
"Past agricultural land use and present-day fire regimes can interact to determine the nature of seed predation","OECOLOGIA",2016,"2015-2016","yes","no","generalized linear mixed models, mixed-model ANOVA, Kenward-Roger approximation, PCA","R and SAS",2,"0","NA","NA","no","no","NA","NA","NA","partially","yes","yes","no","no","NA","NA","AST, AB"
"Past and predicted future effects of housing growth on open space conservation opportunity areas and habitat connectivity around National Wildlife Refuges","LANDSCAPE ECOLOGY",2016,"2015-2016","yes","no","NA, geospatial analysis","Not Stated",NA,"NA","NA","NA","no","no","NA","NA","NA","NA","NA","yes","partially","yes","data on refuges from the USFWS cadastral database, housing data from the U.S. Census Bureau","NA","MP, AB"
"Plant population and genotype effects override the effects of Epichloe endophyte species on growth and drought stress response of Achnatherum robustum plants in two natural grass populations","JOURNAL OF PLANT ECOLOGY",2015,"2015-2016","yes","no","ANOVAs","SYSTAT",1,"1","NA","NA","no","no","NA","NA","NA","no","no","yes","no","no","limited data from Figs","NA","MP, AB"
"Plant-available silicon in paddy soils as a key factor for sustainable rice production in Southeast Asia","BASIC AND APPLIED ECOLOGY",2015,"2015-2016","yes","no","Kruskal-Wallis one-way analysis, Wilcoxon-Mann-Whitney test","Statistica",1,"1","NA","NA","no","no","NA","NA","NA","no","no","yes","no","no","limited data from Figs","NA","MP, AB"
"Population limitation in a non-cyclic arctic fox population in a changing climate","OECOLOGIA",2016,"2015-2016","yes","no","Pearson's correlation, PCA, linear mixed model, chi-sq test","R",1,"0","NA","NA","no","no","NA","NA","NA","yes","yes","yes","partially","yes","Data on population size of pink-footed goose
 Anser brachyrhynchus (Baillon) are counts obtained by the Wildfowl and Wetlands Trust and the Joint Nature Conservation
 Committee, 
 Ppulation indices provided by the British Trust for Ornithology (BTO) (http://www.bto.org/volunteer-surveys/webs, March 2007)
 Data on sheep numbers were obtained from Arnalds and
 Barkarson (2003) and Statistics Iceland (2006)
 The annual NAO index (retrieved 2008 from
 https://climatedataguide.ucar.edu/climate-data/hurrell-north-atlantic-oscillation-nao-index-station-based), and the SPG index (Hátún et al.2005)","NA","MP, AB"
"Predation Threat Alters Composition and Functioning of Bromeliad Ecosystems","ECOSYSTEMS",2015,"2015-2016","yes","no","PERMANOVA and post-hoc pariwise comparisons, multidimenisional scaling (MDS), ANOVAs, Tukex's test, bootstrap methods","R",1,"0","1","1","no","no","NA","NA","NA","yes","yes","yes","yes","yes","Data are available on the Knowledge Network for Biocomplexity (http://knb.ecoinformatics.org/knb/metacat/knb.302.1/knb).","NA","MP, AB"
"Quantification of Ant Manure Deposition in a Tropical Agroecosystem: Implications for Host Plant Nitrogen Acquisition","ECOSYSTEMS",2015,"2015-2016","yes","no","likelihood ratio test, hierarchical linear mixed models, pairwise comparisons","R",1,"0","NA","NA","no","no","NA","NA","NA","yes","yes","yes","no","no","NA","NA","MP, AB"
"Quantifying spatiotemporal pattern of urban greenspace: new insights from high resolution data","LANDSCAPE ECOLOGY",2015,"2015-2016","yes","no","geospatial analysis","Not Stated",NA,"NA","NA","NA","no","no","NA","NA","NA","NA","NA","yes","yes","yes","Remote sensing data (MODIS NOAA-AVHRR SPOT4-VGT; Landsat TM/ETM+ ASTER; SPOT % IKONOS QUICKBIRD)","NA","MP, AB"
"Regurgitation of the koilin layer in chinstrap penguins (Pygoscelis antarcticus) and its association with gastric parasites","POLAR RESEARCH",2016,"2015-2016","yes","no","Descriptive, prevalence (proportion of koilins containing parasites) and the mean intensity (average number of parasites in each koilin containing parasites) with standard deviations, range and 95% confidence intervals (CIs) were calculated using the Clopper-Pearson interval (for prevalence) and 2000 bootstrap replications (for mean inten-
 sity)","SigmaPlot and QP Software",2,"2","NA","NA","no","no","NA","NA","NA","no","no","yes","no","no","NA","NA","MP, AB"
"Retesting a prediction of the River Continuum Concept: autochthonous versus allochthonous resources in the diets of invertebrates","FRESHWATER SCIENCE",2016,"2015-2016","yes","no","ANOVA","SYSTAT",1,"0","NA","NA","no","no","NA","NA","NA","no","no","yes","no","no","NA","NA","AST, AB"
"Salinity and disturbance mediate direct and indirect plant-plant interactions in an assembled marsh community","OECOLOGIA",2016,"2015-2016","yes","no","ANOVA, Tukey's HSD test, relative neighbour effect (RNE), linear regression","Not Stated",NA,"NA","NA","NA","no","no","NA","NA","NA","NA","NA","yes","no","no","limited data from Figs","NA","MP, AB"
"Scale dependence of felid predation risk: identifying predictors of livestock kills by tiger and leopard in Bhutan","LANDSCAPE ECOLOGY",2016,"2015-2016","yes","no","Jacobs’ index D, univariate and multivariate MaxEnt (v.3.3.3k) models, AUC","Maxent",1,"1","NA","NA","no","no","NA","NA","NA","yes","yes","yes","yes","yes","Data sources listed in Table 1","NA","MP, AB"
"Seasonal and temporal changes in species use of the landscape: how do they impact the inferences from multi-scale habitat modeling?","LANDSCAPE ECOLOGY",2016,"2015-2016","yes","no","univariate logistic regression models, multi-scale models, AUC","R",1,"1","1","1","no","no","NA","NA","NA","yes","yes","yes","yes","yes","Data sources listed in Table 1","NA","MP, AB"
"Seasonal Water Column NH4 (+) Cycling Along a Semi-arid Sub-tropical River-Estuary Continuum: Responses to Episodic Events and Drought Conditions","ECOSYSTEMS",2015,"2015-2016","yes","no","Kolmogorov–Smirnov test, rmANOVA, Tukey's HSD test","SYSTAT",1,"1","NA","NA","no","no","NA","NA","NA","no","no","yes","partially","yes","Part of data used for analysis is presented in Table 1","NA","MP, AB"
"Selection for multicomponent mimicry: equal feature salience and variation in preferred traits","BEHAVIORAL ECOLOGY",2016,"2015-2016","yes","no","logistic regression","R",1,"0","1","0","no","no","NA","NA","NA","yes","yes","yes","no","no","analysis_software_names assigned as R even though R is not mentioned, but we could infer it because under Table 2 the authors refer to the lme4 package (it's in R). Neither Rstudio nor lme4 are cited nor listed in References.","I would assign R to analysis_software_names despite not being named explicitly but add a comment saying so. That way we are a bit more conservative in our approach. I have implemented these suggested changes.","MP, AST"
"Shifts in community leaf functional traits are related to litter decomposition along a secondary forest succession series in subtropical China","JOURNAL OF PLANT ECOLOGY",2015,"2015-2016","yes","no","CWM (community mean traits) calculation, multiple regression analysis, PCA","R",1,"1","3","2","no","no","NA","NA","NA","yes","yes","yes","partially","yes","Information on the plot specific CWMs as well as on plot age and species richness in SI https://academic.oup.com/jpe/article/8/4/401/941732","NA","MP, AB"
"Silent listeners: can preferences of eavesdropping midges predict their hosts' parasitism risk?","BEHAVIORAL ECOLOGY",2016,"2015-2016","yes","no","Kolmogorov-Smirnov test, Levene's test, Wilcoxon matched pairs test, ANOVA, linear model","R",1,"0","4","2","no","no","NA","NA","NA","yes","yes","yes","no","no","limited data from Figs","NA","MP, AB"
"Size-dependent response of tropical wetland fish communities to changes in vegetation cover and habitat connectivity","LANDSCAPE ECOLOGY",2015,"2015-2016","yes","no","Kruskal-Wallis test, GAMLSS (generalized aditive model for location, scale and shape), GLMs, GAMs","R",1,"1","4","3","no","no","NA","NA","NA","yes","yes","yes","partially","yes","limited data from Figs, Tables and SI https://link.springer.com/article/10.1007/s10980-015-0196-2","NA","MP, AB"
"Soil microbial community structure and activity in a 100-year-old fertilization and crop rotation experiment","JOURNAL OF PLANT ECOLOGY",2015,"2015-2016","yes","no","log transformation, PCA, RDA","Canoco and SAS",2,"0","NA","NA","no","no","NA","NA","NA","no","no","yes","no","no","NA","NA","AST, AB"
"Soil phosphorus predicts feral pig (Sus scrofa) occupancy, detection probability and feeding activity in a temperate montane rainforest","WILDLIFE RESEARCH",2016,"2015-2016","yes","no","NMDS, cluster analysis, SIMPER analysis, Pearson's correlation, logistic regression, multiseason model, Akaike model weights","Primer and PRESENCE and R",3,"1","NA","NA","no","no","NA","NA","NA","partially","yes","yes","no","no","NA","NA","MP, AB"
"Song adjustments by an open habitat bird to anthropogenic noise, urban structure, and vegetation","BEHAVIORAL ECOLOGY",2016,"2015-2016","yes","no","k-means cluster anaylsis, multiple linear regression, likelihood ratio tests, correlation analysis, Brown-Forsythe test","R",1,"1","NA","NA","no","no","NA","NA","NA","yes","yes","yes","no","no","limited data from Figs","NA","MP, AB"
"Space use by female agile antechinus: are teat number and home-range size linked?","WILDLIFE RESEARCH",2016,"2015-2016","yes","no","GLMs, parametric and non-parametric ANOVA, MDS, Mann-Whitney U test","SYSTAT and Primer and R",3,"3","NA","NA","no","no","NA","NA","NA","partially","yes","yes","partially","yes","limited data from Figs and Tables","NA","MP, AB"
"Spatial patterns of cultural ecosystem services provision in Southern Patagonia","LANDSCAPE ECOLOGY",2016,"2015-2016","yes","no","detrended correspondence analysis (DCA), redundancy analysis (RDA), Monte Carlo permutation test","PC-ORD",1,"1","NA","NA","no","no","NA","NA","NA","no","no","yes","partially","yes","Data sources listed in Table 1","NA","MP, AB"
"Survey data matter: predicted niche of adult vs breeding Odonata","FRESHWATER SCIENCE",2015,"2015-2016","yes","no","Ecological niche modeling","Maxent",1,"1","NA","NA","no","no","NA","NA","NA","yes","yes","yes","no","no","can't access SI https://www.journals.uchicago.edu/doi/suppl/10.1086/682676","NA","MP, AB"
"Survival and local recruitment are driven by environmental carry-over effects from the wintering area in a migratory seabird","OECOLOGIA",2015,"2015-2016","yes","no","multi-state models, goodness-of-fit tests (U-CARE, JMV), covariate models, analysis of deviance (ANODEV)","MARK",1,"1","NA","NA","no","no","NA","NA","NA","yes","yes","yes","yes","yes","Data sources listed in Table 1","NA","MP, AB"
"Temperature can shape a cline in polyandry, but only genetic variation can sustain it over time","BEHAVIORAL ECOLOGY",2016,"2015-2016","yes","no","ANOVA,logistic regression","Not Stated",NA,"NA","NA","NA","no","no","NA","NA","NA","NA","NA","yes","partially","yes","limited data from Figs and SI https://academic.oup.com/beheco/article/27/2/462/2196539?login=true","NA","MP, AB"
"Temperature Dependence of Soil Respiration Modulated by Thresholds in Soil Water Availability Across European Shrubland Ecosystems","ECOSYSTEMS",2016,"2015-2016","yes","no","linear regression, non-linear least squares regression, AICc, MC simulation","R",1,"0","1","0","no","no","NA","NA","NA","yes","yes","yes","no","no","NA","NA","AST, AB"
"The aggressive personality of an introduced fish affects foraging behavior in a polymorphic newt","BEHAVIORAL ECOLOGY",2015,"2015-2016","yes","no","GLMM, LRT, Tukey test, GLM, LMM, F-test","R",1,"1","3","0","no","no","NA","NA","NA","yes","yes","yes","no","no","NA","NA","AST, AB"
"The allometry of reproductive allocation in a Chloris virgata population in response to simulated atmospheric nitrogen deposition","BASIC AND APPLIED ECOLOGY",2016,"2015-2016","yes","no","One-way ANOVA, LSD test, SMA regression","SPSS and SMATR",2,"1","0","NA","no","no","NA","NA","NA","partially","yes","yes","no","no","Although the authors called SMATR a software package, it does not seem to be a package but a stand-along software. AST originally thought SMATR was not free, but it is: https://github.com/dfalster/smatr/","NA","AST, AB"
