"Title","Journal","Publication_year","Publication_year.2","statistical.analysis.and.or.simulations","bioinformatic.analysis","additional.comment.on.analysis","analysis_software_names","num.software.calculated","num.software_with_version","num.packages","num.packages_with_version","CodeShared","CodeShared.2","LinktoCode","LocationShared","Repository","FreeSoftware","FreeSoftware.2","DataUsed","DataShared","DataShared.2","ExtraComments","CommentonComments","Screener"
"The compositional and configurational heterogeneity of matrix habitats shape woodland carabid communities in wooded-agricultural landscapes","LANDSCAPE ECOLOGY",2016,"2015-2016","yes","no","Direct gradient analyses, variation partitioning, response trait analyses, pCCA, pIFS, MC permutations, VIF, correlation, PCNM","Canoco",1,"1","0","NA","no","no","NA","NA","NA","no","no","yes","no","no","Only software reported in the stastistical section were considerd statistical software","NA","AST, AB"
"The demographic consequences of mutualism: ants increase host-plant fruit production but not population growth","OECOLOGIA",2015,"2015-2016","yes","no","AICc, correlation, non-parametric bootstrapping, integral projection models, simulations, ML, GLM, LM","R",1,"1","1","0","no","no","NA","NA","NA","yes","yes","yes","no","no","AB could not find the software used","NA","AST, AB"
"The effectiveness and cost of camera traps for surveying small reptiles and critical weight range mammals: a comparison with labour-intensive complementary methods","WILDLIFE RESEARCH",2015,"2015-2016","yes","no","GLMM","R",1,"1","3","2","no","no","NA","NA","NA","yes","yes","yes","no","no","NA","NA","AST, AB"
"The genetics of chutes and ladders: a community genetics approach to tritrophic interactions","OIKOS",2016,"2015-2016","yes","no","LMM, LRT, GLMM, correlation, AIC, stepwise model selection, regression models","R",1,"0","3","3","no","no","NA","NA","NA","yes","yes","yes","no","no","NA","NA","AST, AB"
"The impact of sheep grazing on the depth of spider burrows and of burrows selected by the pygmy bluetongue lizard (Tiliqua adelaidensis)","WILDLIFE RESEARCH",2016,"2015-2016","yes","no","repeated-measures ANOVA, two-way ANOVA, Mauchlys test","Not Stated",NA,"NA","NA","NA","no","no","NA","NA","NA","NA","NA","yes","no","no","NA","NA","AST, AB"
"The indirect effects of climate variability on the reproductive dynamics and productivity of an avian predator in the arid Southwest","OECOLOGIA",2016,"2015-2016","yes","no","AIC, correlation, one-way ANOVA, Tukey test, Kruskal-Wallis ANOVA, Mann-Whitney test, Wilcoxon test, LM","R and MARK",2,"1","0","NA","no","no","NA","NA","NA","yes","yes","yes","no","no","NA","NA","AST, AB"
"The KDE plus software: a tool for effective identification and ranking of animal-vehicle collision hotspots along networks","LANDSCAPE ECOLOGY",2016,"2015-2016","yes","no","KDE method, MC simulations","KDE+ In Java",1,"1","2","0","yes","yes","http://www.kdeplus.cz/cz/","website","NA","yes","yes","yes","no","no","the KDE+ software is a free-standing java script. I was unsure if #software_with_version should be 0, 1 or NA. One could argue that this is likely the first version given that they are presenting the software in this paper, plus they report that they use Java 7, so I decided to consider it as 1. AB originally considered it as stats no. AST unsure if stats should be yes, but the KDE+ software seems to run some sort of simulations, so we decided to say yes for the stats.","NA","AST, AB"
"The priming effect of soluble carbon inputs in organic and mineral soils from a temperate forest","OECOLOGIA",2015,"2015-2016","yes","no","t test, repeated-measures ANOVA, two-way ANOVA","SPSS",1,"1","0","NA","no","no","NA","NA","NA","no","no","yes","no","no","AB seemingly mixed up statistical.analysis.or/and.simulations and bioinformatic.analysis and said no and yes, respectively. Fixed now.","NA","AST, AB"
"The relative influence of forest loss and fragmentation on insectivorous bats: does the type of matrix matter?","LANDSCAPE ECOLOGY",2015,"2015-2016","yes","no","correlation, ANCOVA, GLM, DFA, Shapiro-Wilk test, Kruskal-Wallis test,","Not Stated",NA,"NA","NA","NA","no","no","NA","NA","NA","NA","NA","yes","no","no","AB originally had DataUsed as NA. Fixed now.","NA","AST, AB"
"The role of serotonin in the modulation of cooperative behavior","BEHAVIORAL ECOLOGY",2015,"2015-2016","yes","no","Mann-Whitney test","SPSS",1,"1","0","NA","no","no","NA","NA","NA","no","no","yes","no","no","NA","NA","AST, AB"
"The significance of geosystem and landscape concepts for the assessment of ecosystem services: exemplified in a case study in Russia","LANDSCAPE ECOLOGY",2015,"2015-2016","yes","no","correlation","Not Stated",NA,"NA","NA","NA","no","no","NA","NA","NA","NA","NA","yes","no","no","NA","NA","AST, AB"
"The stress of growing old: sex- and season-specific effects of age on allostatic load in wild grey mouse lemurs","OECOLOGIA",2015,"2015-2016","yes","no","backward model selection, LMM","R",1,"1","2","2","no","no","NA","NA","NA","yes","yes","yes","no","no","AB originally had bioinformatic.analysis as yes to. Fixed now.","NA","AST, AB"
"The synergistic effect of density stress during the maternal period and adulthood on immune traits of root vole (Microtus oeconomus) individuals-a field experiment","OECOLOGIA",2016,"2015-2016","yes","no","Poisson distribution, GLMM, binary logistic regression, correlation","SPSS",1,"1","0","NA","no","no","NA","NA","NA","no","no","yes","no","no","NA","NA","AST, AB"
"The temperature regimes of dry-season waterholes in tropical northern Australia: potential effects on fish refugia","FRESHWATER SCIENCE",2015,"2015-2016","yes","no","regression, simulations","Not Stated",NA,"NA","NA","NA","no","no","NA","NA","NA","NA","NA","yes","no","no","AST had FreeSoftware as no. Fixed now. AB originally had DataUsed as NA. Fixed now.","NA","AST, AB"
"Trade-offs in lactation and milk intake by competing siblings in a fluctuating environment","BEHAVIORAL ECOLOGY",2016,"2015-2016","yes","no","survival analysis, Mantel test, t test, LMM,Jonckheere–Terpstra test, Haytor–Stone post hoc multiple comparisons, correlation, Wilcoxon test, Mann-Whitney test, MC simulations, power analyses","R and SYSTAT and StatXact and One-Stop-Calculator",4,"4","3","3","no","no","NA","NA","NA","partially","yes","yes","yes","yes","link to data https://doi.org/10.5061/dryad.0m068; although the authors said to run ""mixed-effects general linear model (GLM)"", I believe they ran LMM; the authors also use the One-Stop-Calculator which is free and does not seem to have any versioning that is why I consider it as if the version was provided. AB originally missed the One-Stop-Calculator software as well as the shared data. Fixed now.","NA","AST, AB"
"Trait-based and phylogenetic associations between parasites and their hosts: a case study with small mammals and fleas in the Palearctic","OIKOS",2016,"2015-2016","yes","no","ESLPT analysis, RLQ analysis, correlations, root-skewness test, CA, PCoA, factorial analyses","R",1,"0","3","1","partially","yes","https://doi.org/10.1111/j.1365-2745.2010.01743.x; https://doi.org/10.1111/ecog.00915","supplementary material","NA","yes","yes","yes","no","no","Detailed R code for the ESLPT analysis can be found in supplementary material of the following publication: https://doi.org/10.1111/j.1365-2745.2010.01743.x; and an example of the annotated R code is available from the supplementary material of the following publication https://doi.org/10.1111/ecog.00915. Despite so, I believe not all code is provided (e.g. that for the correlations). There is some sort of data shared, or what it looks like, but I don't think it is raw data or even complete. AB originally thought there was no code shared. Fixed now.","NA","AST, AB"
"Tree diversity alters the structure of a tri-trophic network in a biodiversity experiment","OIKOS",2015,"2015-2016","yes","no","simulations, p-values from simulations, networks","R",1,"1","2","0","no","no","NA","NA","NA","yes","yes","yes","no","no","NA","NA","AST, AB"
"Turbidity weakens selection for assortment in body size in groups","BEHAVIORAL ECOLOGY",2016,"2015-2016","yes","no","binomial test, Wald method, proportion test, GLMM, Wilcox test, LMM","R",1,"1","0","NA","no","no","NA","NA","NA","yes","yes","yes","no","no","no packages reported, but they should have been given that the authors ran mixed models","NA","AST, AB"
"Ultraviolet-B-induced DNA damage and ultraviolet-B tolerance mechanisms in species with different functional groups coexisting in subalpine moorlands","OECOLOGIA",2016,"2015-2016","yes","no","hierarchical cluster analysis, GLMM, stepwise multiple regression","SAS",1,"1","0","NA","no","no","NA","NA","NA","no","no","yes","no","no","AB originally had bioinformatic.analysis as yes to. Fixed now.","NA","AST, AB"
"Using site-occupancy models to prepare for the spread of chytridiomyosis and identify factors affecting detectability of a cryptic susceptible species, the Tasmanian tree frog","WILDLIFE RESEARCH",2015,"2015-2016","yes","no","modelling, AIC","PRESENCE",1,"0","0","NA","no","no","NA","NA","NA","yes","yes","yes","no","no","NA","NA","AST, AB"
"Variation in seed dispersal effectiveness: the redundancy of consequences in diversified tropical frugivore assemblages","OIKOS",2016,"2015-2016","yes","no","bootstrapping, correlation, multiple regression, linear regression","R",1,"1","1","0","no","no","NA","NA","NA","yes","yes","yes","yes","yes","link to data https://doi.org/10.5061/dryad.3k8h7","NA","AST, AB"
"Weak olfaction increases seed scatter-hoarding by Siberian chipmunks: implication in shaping plant-animal interactions","OIKOS",2016,"2015-2016","yes","no","one-way ANOVA, GLM","SPSS",1,"1","0","NA","no","no","NA","NA","NA","no","no","yes","no","no","the correct doi to where the data should be is https://doi.org/10.5061/dryad.c1d09. There is, however, no raw data, only summary stastitics and some plots","NA","AST, AB"
"What is an apex predator?","OIKOS",2015,"2015-2016","yes","no","PCA, regression, logistic regression, Davies test","SPSS",1,"0","1","0","no","no","NA","NA","NA","no","no","yes","no","no","AST had R as software and freesoftware yes. Fixed now.","NA","AST, AB"
"Who cares? Experimental attention biases provide new insights into a mammalian sexual signal","BEHAVIORAL ECOLOGY",2016,"2015-2016","yes","no","linear mixed model, Kruskal–Wallis test,  χ2 goodness-of-fit","SPSS",1,"1","0","NA","no","no","NA","NA","NA","no","no","yes","no","no","NA","NA","AST, AB"
"Why fly the extra mile? Using stress biomarkers to assess wintering habitat quality in migratory shorebirds","OECOLOGIA",2016,"2015-2016","yes","no","linear models, non-parametric Kruskal Wallis test, Chi-squared test","R",1,"1","1","0","no","no","NA","NA","NA","yes","yes","yes","no","no","NA","NA","AST, AB"
"Winter durability of pygmy bluetongue lizard burrows is higher for occupied than for unoccupied burrows and for those in less-grazed neighbourhoods","WILDLIFE RESEARCH",2016,"2015-2016","yes","no","logistic regression, AIC, repeated-measures ANOVA","SPSS",1,"1","0","NA","no","no","NA","NA","NA","no","no","yes","no","no","NA","NA","AST, AB"
"Zooplankton eat what they need: copepod selective feeding and potential consequences for marine systems","OIKOS",2016,"2015-2016","yes","no","multiple regression (stepwise, bidirectional) analysis","Not Stated",NA,"NA","NA","NA","no","no","NA","NA","NA","NA","NA","yes","no","no","NA","NA","AST, AB"
"A comparison of unmanned aerial vehicles (drones) and manned helicopters for monitoring macropod populations","WILDLIFE RESEARCH",2018,"2018-2019","yes","no","Students t-test, a log-likelihood ratio test (G-test).  Five detection function models were considered: a uniform key function, plus either a cosine or simple polynomial series expansion; a half-normal key function, plus either a cosine or a Hermite polynomial series expansion; and a hazard-rate key function, plus a cosine series expansion","R",1,"1","0","NA","no","no","NA","NA","NA","yes","yes","yes","no","no","Animal density was calculated by conventional distance sampling methods using DISTANCE 6.0","NA","AC, AB"
"A practical method for creating a digital topographic surface for ecological plots using ground-based measurements","LANDSCAPE ECOLOGY",2018,"2018-2019","yes","no","Pearson correlation coefficient","R",1,"1","0","NA","no","no","NA","NA","NA","yes","yes","yes","no","no","also conducted Digital Topographic Model. R code and data for this are available.","NA","AC, AB"
"A tale of two wildfires; testing detection and prediction of invasive species distributions using models fit with topographic and spectral indices","LANDSCAPE ECOLOGY",2018,"2018-2019","yes","no","species distribution modells (include included generalized linear model (GLM), boostedregression trees (BRT), multivariate adaptive regression splines (MARS), and Random Forest (RF), senisitivy analysis","VisTrails’ Software For Assisted Habitat Modeling",1,"0","NA","NA","no","no","NA","NA","NA","yes","yes","yes","yes","yes","Not sure if this data file also conatins info on analysis runs. Data available from the ScienceBase Repository: https://doi.org/10.5066/p9w0vf4f (Jarnevich and West 2018).","NA","AC, AB"
"Abundance of urban male mosquitoes by green infrastructure types: implications for landscape design and vector management","LANDSCAPE ECOLOGY",2018,"2018-2019","yes","no","GLMs","SPSS",1,"1","NA","NA","no","no","NA","NA","NA","no","no","yes","no","no","NA","NA","AC, AB"
"Adult social environment alters female reproductive investment in the cricket Gryllus firmus","BEHAVIORAL ECOLOGY",2018,"2018-2019","yes","no","path analysis, χ2 test","SPSS Amos",1,"1","NA","NA","no","no","NA","NA","NA","no","no","yes","yes","yes","Analyses reported in this article can be reproduced using the data provided by Conroy and Roff (2017).","NA","AC, AB"
"Age-dependent effects of predation risk on night-time hypothermia in two wintering passerine species","OECOLOGIA",2019,"2018-2019","yes","no","linear model, Tukey HSD","R",1,"1","1","1","no","no","NA","NA","NA","yes","yes","yes","yes","yes","Data available from the Dryad Digital Repository: 10.5061/dryad.7pm1470","NA","AC, AB"
"Alternative reproductive tactics and lifetime reproductive success in a polygynandrous mammal","BEHAVIORAL ECOLOGY",2019,"2018-2019","yes","yes","GLMs, the Clopper–Pearson method for calculatin CIs, Welch 2-sample t-test,  Mann–Whitney U test","R",1,"1","0","NA","no","no","NA","NA","NA","yes","yes","yes","yes","yes","Data accessibility: Analyses reported in this article can be reproduced using the data provided by Balmer et al. (2018).","NA","AC, AB"
"Altitudinal patterns of maximum plant height on the Tibetan Plateau","JOURNAL OF PLANT ECOLOGY",2018,"2018-2019","yes","no","linear regression, piecewise linear regression, phyologenetically indepenedent contrasts","R",1,"0","3","1","no","no","NA","NA","NA","yes","yes","yes","no","no","Also used software Phylocom for Phylogenetic anlaysis","NA","AC, AB"
"Amino acid composition reveals functional diversity of zooplankton in tropical lakes related to geography, taxonomy and productivity","OECOLOGIA",2018,"2018-2019","yes","no","PCA, linear discrimination analysis, functional diversity calculation","R",1,"0","1","1","no","no","NA","NA","NA","yes","yes","yes","no","no","Calculation of functinal diversity considered as type of stat analysis here","NA","AC, AB"
"Among-individual heterogeneity in maternal behaviour and physiology affects reproductive allocation and offspring life-history traits in the garter snake Thamnophis elegans","OIKOS",2018,"2018-2019","yes","no","logistic regression, likelihood ratio test, PCA, oredinary least-squares regression, Kendalls W, mixed effects models, Kenward-Roger Degrees of Freedom Approximation","R and SAS",2,"1","2","0","no","no","NA","NA","NA","partially","yes","yes","no","no","R version not provided, SAS version provided. Have also done biochemical analysis, behaviour scored using JWatcher","NA","AC, AB"
"An objective road risk assessment method for multiple species: ranking 166 reptiles and amphibians in California","LANDSCAPE ECOLOGY",2018,"2018-2019","yes","no","risk analysis","Not Stated",NA,"NA","NA","NA","no","no","NA","NA","NA","NA","NA","yes","partially","yes","some data tables are in supplements. Even though it is borderline, we consider it as statistical.analysis.or/and.simulations = yes, with the addition that the authors seemingly performed at least some correlations, e.g. ""The scores are linearly correlated with increasing movement distance."" and they perform averages, use 95% quantiles to make decisions...","NA","AC, AST, AB"
"Anthropogenic disturbances strengthened tree community-environment relationships at the temperate-boreal interface","LANDSCAPE ECOLOGY",2018,"2018-2019","yes","no","Sørensen dissimilarity, permutation-basedtest of multivariate homogeneity, redundancy analysis, third-degree polynomial Equation, distance-based Moran’s eigenvector analysis, Forward selection with permutation tests, bootstrapping, PCA, Monte-Carlo paired tests","R",1,"0","2","2","no","no","NA","NA","NA","yes","yes","yes","no","no","also calulated beta diversity indeces.","NA","AC, AB"
"Arena size modulates functional responses via behavioral mechanisms","BEHAVIORAL ECOLOGY",2019,"2018-2019","yes","no","ANCOVAS, mathematical modelling of functional responses","Not Stated",NA,"NA","NA","NA","no","no","NA","NA","NA","NA","NA","yes","yes","yes","Data accessibility: Analyses reported in this article can be reproduced using the data provided by Uiterwaal et al. (2018). analyzed each video using the automated tracking program Ctrax. Unclear: From these tracking data, we then used Matlab to determine in every frame the shortest distance between each individual’s location and the arena edge and created frequency distributions of distance to edge for each arena size.","NA","AC, AB"
"Assessing the interplay between canopy energy balance and photosynthesis with cellulose delta O-18: large-scale patterns and independent ground-truthing","OECOLOGIA",2018,"2018-2019","yes","no","sensitivity analysis, mathematical modelling","Not Stated",NA,"NA","NA","NA","no","no","NA","NA","NA","NA","NA","yes","partially","yes","Some data in excel suppl file - but it is unclear what these data represent as they are not mentioned in the text. Isotope anlaysis. spectormetry","NA","AC, AB"
"Bet hedging in stochastic habitats: an approach through large branchiopods in a temporary wetland","OECOLOGIA",2018,"2018-2019","yes","no","linear regression, Mann–Whitney U test, simulations","SYSTAT",1,"1","0","NA","no","no","NA","NA","NA","no","no","yes","partially","yes","The datasets analyzed during the current study are available in the Google Drive (http://drive.google.com/open?id=1fi-4Clu46M4o-J7jqYlaJdWZQRJF9a-D). The climatic datasets analyzed during current study (i.e., precipitation and mean air temperature) are not publicly available due to the charge (only precipitation data available freely for the most recent ten years: http://www.cwb.gov.tw/V7/climate/dailyPrecipitation/dP.htm, Central Weather Bureau, Taiwan), but are available from the corresponding author on reasonable request.","NA","AC, AB"
"Bleaching and mortality of a photosymbiotic bioeroding sponge under future carbon dioxide emission scenarios","OECOLOGIA",2018,"2018-2019","yes","no","ANOVA, Tukey’s multiple comparison tests","Statistica",1,"1","0","NA","no","no","NA","NA","NA","no","no","yes","partially","yes","limited raw data avaiable www.pmel.noaa.gov/co2/","NA","AC, AB"
"Broussonetia papyrifera controls nutrient return to soil to facilitate its invasion in a tropical forest of Ghana","JOURNAL OF PLANT ECOLOGY",2018,"2018-2019","yes","no","ANOVA, Mauchly tests, Mauchly tests, Pearson’s product-moment correlation analysis","R",1,"0","0","NA","no","no","NA","NA","NA","yes","yes","yes","no","no","NA","NA","AC, AB"
"Calling in the heat: the zebra finch incubation call depends on heat but not reproductive stage","BEHAVIORAL ECOLOGY",2018,"2018-2019","yes","no","general linear mixed model, linear mixed model, t-test","R",1,"0","1","0","yes","yes","https://doi.org/10.1093/beheco/ary123","supplementary material","NA","yes","yes","yes","yes","yes","Data accessibility: Analyses reported in this article can be reproduced using the R script provided as a Supplementary File and the data provided by McDiarmid et al. (2018). Supplementary files contains R code. also used automatic acoustic detection software (Kaleidoscope Pro 4.1.0a","NA","AC, AB"
"Can we face different types of storms under the same umbrella? Efficiency and consistency of connectivity umbrellas across different patchy landscape patterns","LANDSCAPE ECOLOGY",2018,"2018-2019","yes","no","a stochastic simulation method called modified random clusters, landscape-resistance models, Conditional Minimum Transit Cost (CMTC) method, factorial ANOVA via permutation tests","SIMMAP and R",2,"2","0","NA","no","no","NA","NA","NA","yes","yes","yes","no","no","NA","NA","AC, AB"
"Captive husbandry and veterinary care of seabirds during the MV Rena oil spill response","WILDLIFE RESEARCH",2019,"2018-2019","yes","no","Cox Regression analysis, Binomial logistic regression, Chi-square analysis, Fishers Exact test, Mann–Whitney U-tests","SPSS",1,"1","0","NA","no","no","NA","NA","NA","no","no","yes","no","no","some limited data might be possible to read from graphs","NA","AC, AB"
"Carbon storage potential increases with increasing ratio of C-4 to C-3 grass cover and soil productivity in restored tallgrass prairies","OECOLOGIA",2018,"2018-2019","yes","no","linear models, Monte Carlo methods, model averiging,  χ 2 tests and root mean square error of approximation","R and SPSS Amos",2,"2","1","0","no","no","NA","NA","NA","partially","yes","yes","no","no","done soil analysis, biochemical analysis. used AccuPAR LP-80. My understanding is that AMOS is not free","NA","AC, AB"
"Climate-Induced Changes in Spring Snowmelt Impact Ecosystem Metabolism and Carbon Fluxes in an Alpine Stream Network","ECOSYSTEMS",2018,"2018-2019","yes","no","simulations (spatially explicit hydrological model), Monte Carlo simulations, non linear maximisation, night-time regression approach, linear and logarithmic models, generalized least squares model, two-way ANOVA,  linear mixed effect models","R",1,"0","3","0","no","no","NA","NA","NA","yes","yes","yes","no","no","also conducted biochemical analyses","NA","AC, AB"
"Climate change and temporal trends in body size: the case of rodents","OIKOS",2018,"2018-2019","yes","no","linear regrassion, non-lineal models, χ2-test, Pearson product-moment correlation, phylogenetic generalized linear mixed model","R and Statistica",2,"0","3","1","no","no","NA","NA","NA","partially","yes","yes","yes","yes","Data available from the Dryad Digital Repository: < http://dx.doi.org/10.5061/dryad.3q67545 > (Villar and Naya 2018).","NA","AC, AB"
"Climate change will affect the ability of forest management to reduce gaps between current and presettlement forest composition in southeastern Canada","LANDSCAPE ECOLOGY",2019,"2018-2019","yes","no","simulation of forest dynamics, simulations for forest gap model , two-way factorial PERMANOVA","LANDIS-II and PICUS and R",3,"2","4","4","no","no","NA","NA","NA","yes","yes","yes","partially","yes","Landis extensions were scored as packages. It appears that landis does not have versions. some data downloaded from the World Climate Research Program (WCRP) Climate Model Intercomparison Project Phase 5 (CMIP5) archive. some data are in the form of input model parameters","NA","AC, AB"
"Combining plant-frugivore networks for describing the structure of neotropical communities","OIKOS",2018,"2018-2019","yes","no","graph and network analyses, linear regression","R and ANINHADO and MODULAR and NetCarto",4,"3","2","2","no","no","NA","NA","NA","yes","yes","yes","partially","yes","NetCarto  software does not have versions. Also used software QGIS ver. 2.16.0-Nødebo for building maps, Pajek for network visualisation","NA","AC, AB"
"Competition along productivity gradients: news from heathlands","OECOLOGIA",2018,"2018-2019","yes","no","mixed modelling, post hoc multiple comparisons, ANOVA, Cox proportional hazard models","R",1,"0","3","0","no","no","NA","NA","NA","yes","yes","yes","no","no","also conducted biochemical analyses","NA","AC, AB"
"Conceptual framework for evaluation of ecotourism carrying capacity for sustainable development of Karkheh protected area, Iran","INTERNATIONAL JOURNAL OF SUSTAINABLE DEVELOPMENT AND WORLD ECOLOGY",2019,"2018-2019","yes","no","analytic network process model","Super Decision Software",1,"1","0","NA","no","no","NA","NA","NA","yes","yes","yes","no","no","also used ArcGis","NA","AC, AB"
"Considering landscape connectivity and gene flow in the Anthropocene using complementary landscape genetics and habitat modelling approaches","LANDSCAPE ECOLOGY",2019,"2018-2019","yes","yes","linear mixed effect model, pearsons correlation, MAXENT model, nonparametric robust γ-rank correlation tests, correlations, concetivity modelling, hierarchical clustering analyses","CONFEOR and R and LINKAGE MAPPER Software and CIRCUITSCAPE Software and PINCH POINT MAPPER Software and BARRIER MAPPER",6,"1","2","0","no","no","NA","NA","NA","yes","yes","yes","no","no","also used GeneMapper 3.7 software","NA","AC, AB"
"Constraints on treeline advance in a warming climate: a test of the reproduction limitation hypothesis","JOURNAL OF PLANT ECOLOGY",2018,"2018-2019","yes","no","ANOVA, post-hoc Tukey HSD, multinomial logistic regression","R",1,"1","0","NA","no","no","NA","NA","NA","yes","yes","yes","no","no","NA","NA","AC, AB"
