"Title","Journal","Publication_year","Publication_year.2","statistical.analysis.and.or.simulations","bioinformatic.analysis","additional.comment.on.analysis","analysis_software_names","num.software.calculated","num.software_with_version","num.packages","num.packages_with_version","CodeShared","CodeShared.2","LinktoCode","LocationShared","Repository","FreeSoftware","FreeSoftware.2","DataUsed","DataShared","DataShared.2","ExtraComments","CommentonComments","Screener"
"Habitat choice and complex decision making in a trap-building predator","BEHAVIORAL ECOLOGY",2016,"2015-2016","yes","no","Fisher’s exact test, log-linear model, paired t-test, 2-way Ancova","Not Stated",NA,"NA","NA","NA","no","no","NA","NA","NA","NA","NA","yes","no","no","NA","NA","AC, MP, AB"
"A comparative framework to infer landscape effects on population genetic structure: are habitat suitability models effective in explaining gene flow?","LANDSCAPE ECOLOGY",2015,"2015-2016","yes","yes","multi-model landscape genetic approach, factorial multi-model approach, resistance models, model evaluation, univariate/multivariate optimization, habitat suitability models, Mantel test, reciprocial causal modeling","R",1,"0","1","0","no","no","NA","NA","NA","yes","yes","yes","no","no","ecodist package in R; FRAG-STATS 3.4 to calculate a set of metrics quantifying different aspects of landscape structure","NA","AC, MP, AB"
"A dark cuticle allows higher investment in immunity, longevity and fecundity in a beetle upon a simulated parasite attack","OECOLOGIA",2016,"2015-2016","yes","no","Kolmogorov–Smirnov test, ANOVA, Cox proportional hazards model, linear mixed model","Not Stated",NA,"NA","NA","NA","no","no","NA","NA","NA","NA","NA","yes","no","no","Imagj software used for immage analysis. conducted immune asseys","NA","AC, MP, AB"
"A decomposition analysis of CO2 emissions: evidence from Malaysia's tourism industry","INTERNATIONAL JOURNAL OF SUSTAINABLE DEVELOPMENT AND WORLD ECOLOGY",2016,"2015-2016","yes","no","Unit root tests, Bound tests, Granger causality tests","Not Stated",NA,"NA","NA","NA","no","no","NA","NA","NA","NA","NA","yes","no","no","NA","NA","AC, MP, AB"
"Climate as an agent of change in forest landscapes","LANDSCAPE ECOLOGY",2016,"2015-2016","yes","no","DISTRIB II model, SHIFT model","Not Stated",NA,"NA","NA","NA","no","no","NA","NA","NA","NA","NA","yes","partially","yes","Predictors used for the DISTRIB II model","NA","AC, MP, AB"
"A new cost-effective approach to survey ecological communities","OIKOS",2016,"2015-2016","yes","no","Simulation of ecological communities (Species-abundance distributions), clustering (Matérn cluster proces), correlation, PCA","R",1,"0","4","1","no","no","NA","NA","NA","yes","yes","yes","no","no","‘spatstat’ package authors and version in references; they simulate data and use data from another study (that are not available)","NA","AC, MP, AB"
"A portable, modular, self-contained recirculating chamber to measure benthic processes under controlled water velocity","FRESHWATER SCIENCE",2015,"2015-2016","yes","no","linear regression","R",1,"1","0","NA","no","no","NA","NA","NA","yes","yes","yes","no","no","data shared in a Fig 6, so only graphically","NA","AC, AB"
"A test of energetic trade-offs between growth and immune function in watersnakes","OECOLOGIA",2015,"2015-2016","yes","no","mixed-effect models","R",1,"0","0","NA","no","no","NA","NA","NA","yes","yes","yes","no","no","NA","NA","AC, AB"
"Accounting for the causal basis of collinearity when measuring the effects of habitat loss versus habitat fragmentation","OIKOS",2016,"2015-2016","yes","no","simulations, multiple regression, path analysis, lavaans x2 test","R",1,"1","2","1","no","no","NA","NA","NA","yes","yes","no","NA","NA","mention that they have used base package of R, but this is not counted as a package (agreed between AST and AC)","NA","AC, AST"
"Adjustment of costly extra-group paternity according to inbreeding risk in a cooperative mammal","BEHAVIORAL ECOLOGY",2015,"2015-2016","yes","yes","LMMs and GLMMs","R",1,"1","2","1","no","no","NA","NA","NA","yes","yes","yes","no","no","Microsatellite sequences are available from Genbank: accession numbers provided.","NA","AC, AB"
"Adult helpers increase the recruitment of closely related offspring in the cooperatively breeding rifleman","BEHAVIORAL ECOLOGY",2016,"2015-2016","yes","yes","linear mixed-effects model, restricted maximum-likelihood, analysis of covariance","R",1,"1","1","0","no","no","NA","NA","NA","yes","yes","yes","no","no","note that version of the package is mentioned in the references, but seems something went wrong in referencing, so one cannot see the real version","NA","AC, AB"
"Algal biomass and pigments along a latitudinal gradient in Victoria Land lakes, East Antarctica","POLAR RESEARCH",2016,"2015-2016","yes","no","PCA","Not Stated",NA,"NA","NA","NA","no","no","NA","NA","NA","NA","NA","yes","partially","yes","data shared partly via Figures, and some in the supl. PDF file","NA","AC, AB"
"An empirical test of stable species coexistence in an amphipod species complex","OECOLOGIA",2015,"2015-2016","yes","no","one-sample t-test. GLM, multivariate analysis of variance","Not Stated",NA,"NA","NA","NA","no","no","NA","NA","NA","NA","NA","yes","no","no","some data shared in suppl. Figs","NA","AC, AB"
"An invasive slug exploits an ant-seed dispersal mutualism","OECOLOGIA",2016,"2015-2016","yes","no","GLMM, GLM, paired t test","R",1,"1","0","NA","no","no","NA","NA","NA","yes","yes","yes","no","no","NA","NA","AC, AB"
"Associational resistance or susceptibility: the indirect interaction between chemically-defended and non-defended herbivore prey via a shared predator","OIKOS",2016,"2015-2016","yes","no","LME models, x2-tests, REML, GLMM","R",1,"1","3","3","no","no","NA","NA","NA","yes","yes","yes","yes","yes","NA","NA","AC, AB"
"Belowground fungal associations and water interact to influence the compensatory response of Ipomopsis aggregata","OECOLOGIA",2016,"2015-2016","yes","no","MANOVA, t-test, ANOVA, ANCOVA","R",1,"1","2","0","no","no","NA","NA","NA","yes","yes","yes","no","no","NA","NA","AC, AB"
"Biodiversity conservation across taxa and landscapes requires many small as well as single large habitat fragments","OECOLOGIA",2015,"2015-2016","yes","no","randomisation, redundancy analyses, nonlinear mixed-effects models, permutation test, glms, mantel test","EstimateS and R",2,"2","4","3","no","no","NA","NA","NA","yes","yes","yes","yes","yes","data in suppl. PDF file","NA","AC, AB"
"Biome-specific effects of nitrogen and phosphorus on the photosynthetic characteristics of trees at a forest-savanna boundary in Cameroon","OECOLOGIA",2015,"2015-2016","yes","no","linear regression, bootstrapping","R",1,"0","0","NA","no","no","NA","NA","NA","yes","yes","yes","no","no","some data might be possible to read from figures","NA","AC, AB"
"Biotic and Abiotic Factors Interact to Regulate Northern Peatland Carbon Cycling","ECOSYSTEMS",2015,"2015-2016","yes","no","repeated measures mixed effects models, GLM","STATA",1,"1","0","NA","no","no","NA","NA","NA","no","no","yes","yes","yes","data available from https://datadryad.org/stash/dataset/doi:10.5061/dryad.ks10q","NA","AC, AB"
"Biotic invasions can alter nutritional composition of zooplankton communities","OIKOS",2015,"2015-2016","yes","no","PCA, non-parametric Welch's test,  Mann–Kendall test","R",1,"1","0","NA","no","no","NA","NA","NA","yes","yes","yes","no","no","Data accessibility: Data will be archived in the public archive Dryad (http://datadryad.org). also, some data are from other sournces and these might be available","NA","AC, AB"
"Budget of Primary Production and Dinitrogen Fixation in a Highly Seasonal Red Sea Coral Reef","ECOSYSTEMS",2016,"2015-2016","yes","no","PERMANOVA, PCO, Canonical analysis of principal coordinates","Primer",1,"1","1","1","no","no","NA","NA","NA","no","no","yes","partially","yes","Primer is a software in itself, no need to have the extension, so I could call this extension a package. I have modified analysis_software_names to simply Primer (instead of Primer-E for consistency throughout the dataset). Does #packages already reflect the Permanova extension as a package or where does the 1 come from? Permanova does not seem to have any versioning so I would put 1 for #packages_with_version as long as the version for Primer is provided (which it is).","NA","AC, AST, AB"
"Butterfly assemblages in residential gardens are driven by species' habitat preference and mobility","LANDSCAPE ECOLOGY",2016,"2015-2016","yes","no","PCA, GLMM","R",1,"1","1","0","no","no","NA","NA","NA","yes","yes","yes","partially","yes","very limited data available","NA","AC, AB"
"Changes in the apparent survival of a tropical bird in response to the El Nio Southern Oscillation in mature and young forest in Costa Rica","OECOLOGIA",2015,"2015-2016","yes","no","PCA, survival models, analysis of devianc","R and MARK",2,"0","0","NA","no","no","NA","NA","NA","yes","yes","yes","no","no","NA","NA","AC, AB"
"Changing gears during succession: shifting functional strategies in young tropical secondary forests","OECOLOGIA",2015,"2015-2016","yes","no","linear mixed-effects model, variance partitioning","R",1,"1","3","1","no","no","NA","NA","NA","yes","yes","yes","no","no","very limited data available (probably can be obtained from suppl Fig)","NA","AC, AB"
"Climate change and wildfire risk in an expanding wildland-urban interface: a case study from the Colorado Front Range Corridor","LANDSCAPE ECOLOGY",2015,"2015-2016","yes","no","CHANGE model (spatially explicit model), ANOVA, linear regression, 2 sample t-test","R",1,"0","1","0","no","no","NA","NA","NA","yes","yes","yes","no","no","searching for the conference proceedings the cite, leads me to realize that CHANGE is very likely programmed in C++, see https://www.researchgate.net/profile/Terry-Sohl/publication/263755619_A_simulation_model_of_human-natural_interactions_in_dynamic_landscapes/links/0c96053bd467992f3c000000/A-simulation-model-of-human-natural-interactions-in-dynamic-landscapes.pdf But it is uncler if CHANGE is in itself a software. I would suggest we are conservative and don't count it, so analysis_software_names = R","NA","AC, AST, AB"
"Climatic events inducing die-off in Mediterranean shrublands: are species' responses related to their functional traits?","OECOLOGIA",2016,"2015-2016","yes","no","linear and quadratic polynomial fits, PCA, linear fits, GLM","JMP",1,"1","0","NA","no","no","NA","NA","NA","no","no","yes","no","no","NA","NA","AC, AB"
"Combined effects of area, connectivity, history and structural heterogeneity of woodlands on the species richness of hoverflies (Diptera: Syrphidae)","LANDSCAPE ECOLOGY",2016,"2015-2016","yes","no","GLM, GOF","R",1,"1","2","1","no","no","NA","NA","NA","yes","yes","yes","yes","yes","quantified forest isolation and connectivity too. Data are 'hidden' in the supplement with no reference that it is data","NA","AC, AB"
"Comparative efficacy of levonorgestrel and deslorelin contraceptive implants in free-ranging eastern grey kangaroos (Macropus giganteus)","WILDLIFE RESEARCH",2016,"2015-2016","yes","no","ANOVA, GLMM, Fisher's exact test","SPSS",1,"1","0","NA","no","no","NA","NA","NA","no","no","yes","no","no","NA","NA","AC, AB"
"Complex demographic responses of a common small mammal to a plant invasion","WILDLIFE RESEARCH",2016,"2015-2016","yes","no","Huggins closed-capture model, GLMM, survival models","MARK",1,"0","0","NA","no","no","NA","NA","NA","yes","yes","yes","no","no","not stated the software used for GLMMs","NA","AC, AB"
"Consumer-plant interaction strength: importance of body size, density and metabolic biomass","OIKOS",2015,"2015-2016","yes","no","linear model, non-linear logarithmic functions","R",1,"0","2","0","no","no","NA","NA","NA","yes","yes","yes","no","no","NA","NA","AC, AB"
"Contrasting environments shape thermal physiology across the spatial range of the sandhopper Talorchestia capensis","OECOLOGIA",2015,"2015-2016","yes","no","ANCOVA, Tukey HDS test, PERMANOVA","Statistica and R",2,"1","0","NA","no","no","NA","NA","NA","partially","yes","yes","partially","yes","one dataset available in a PDF as supplement","NA","AC, AB"
"Costs of social dispersal in a polygynous mammal","BEHAVIORAL ECOLOGY",2015,"2015-2016","yes","no","path analysis, log-rank test, survival analysis, 
Non-parametric constraints space analyses","R",1,"1","2","1","no","no","NA","NA","NA","yes","yes","yes","no","no","NA","NA","AC, AB"
"Deciduous trees increase bat diversity at stand and landscape scales in mosaic pine plantations","LANDSCAPE ECOLOGY",2016,"2015-2016","yes","no","linear mixed models, stance-based Redundancy Analysis, Monte Carlo permutation tests","R",1,"0","2","2","no","no","NA","NA","NA","yes","yes","yes","no","no","NA","NA","AC, AB"
"Development of edge effects around experimental ecosystem hotspots is affected by hotspot density and matrix type","LANDSCAPE ECOLOGY",2016,"2015-2016","yes","no","LMMs","R",1,"1","1","1","no","no","NA","NA","NA","yes","yes","yes","no","no","NA","NA","AC, AB"
"Direction of interaction between mountain pine beetle (Dendroctonus ponderosae) and resource-sharing wood-boring beetles depends on plant parasite infection","OECOLOGIA",2016,"2015-2016","yes","no","GLM, Goodness of fit. linear regression, bootstrap analysis, Pearson’s correlations","SAS",1,"1","0","NA","no","no","NA","NA","NA","no","no","yes","no","no","NA","NA","AC, AB"
"Disentangling the Litter Quality and Soil Microbial Contribution to Leaf and Fine Root Litter Decomposition Responses to Reduced Rainfall","ECOSYSTEMS",2016,"2015-2016","yes","no","PERMANOVA, PCO (visualisation), GLMM","Primer and R",2,"0","0","NA","no","no","NA","NA","NA","partially","yes","yes","no","no","NA","NA","AC, AB"
"Disentangling the relative importance of species occurrence, abundance and intraspecific variability in community assembly: a trait-based approach at the whole-plant level in Mediterranean forests","OIKOS",2016,"2015-2016","yes","no","principal component analysis, Pearson ́s correlation analyses,  Kolmogorov–Smirnov test, ANOVA, Tukey’s tes, redundancy analysis","SPSS and R",2,"2","2","1","no","no","NA","NA","NA","partially","yes","yes","partially","yes","could not find the supplement, thought it is mentioned","NA","AC, AST, AB"
"Dispersal of a defensive symbiont depends on contact between hosts, host health, and host size","OECOLOGIA",2015,"2015-2016","yes","no","GLMs, simulations","R",1,"1","2","0","no","no","NA","NA","NA","yes","yes","yes","no","no","NA","NA","AC, AB"
"Drivers of synchronized vigilance in wild boar groups","BEHAVIORAL ECOLOGY",2016,"2015-2016","yes","no","LMMs, backward stepwise model selection, students t-test, permutations, simulations, Wilcoxon Signed-Rank Test","R",1,"0","1","0","no","no","NA","NA","NA","yes","yes","yes","no","no","some data might be possible to read from Figs","NA","AC, AB"
"Drought increases the impact of introduced European foxes on breeding Australian pelicans","WILDLIFE RESEARCH",2016,"2015-2016","yes","no","GLMs, path analysis","SPSS",1,"1","0","NA","no","no","NA","NA","NA","no","no","yes","no","no","very limited climitic data potetnially available","NA","AC, AB"
"Drying responses of microbial litter decomposition and associated fungal and bacterial communities are not affected by emersion frequency","FRESHWATER SCIENCE",2015,"2015-2016","yes","yes","ANOVa, Tukeys test, PERMANOVA, linear regression, Mantel correlation analysis","R and PERMANOVA",2,"2","1","1","no","no","NA","NA","NA","partially","yes","yes","no","no","assumed that 6 marks the version of PERMANOVA software. supplement not OA","NA","AC, AST, AB"
"Ecological succession following forest decline in a xeric oak forest of south-central United States","JOURNAL OF PLANT ECOLOGY",2016,"2015-2016","yes","no","ANOVA, t-test","SPSS",1,"1","0","NA","no","no","NA","NA","NA","no","no","yes","no","no","NA","NA","AC. AB"
"Ecological traits reveal functional nestedness of bird communities in habitat islands: a global survey","OIKOS",2015,"2015-2016","yes","no","PCA, cluster analysis, permunations","R",1,"1","4","2","no","no","NA","NA","NA","yes","yes","yes","no","no","mention that they have used base package of R , but we do not count this as a package","NA","AC, AST, AB"
"Edges within farmland: Management implications of taxon specific species richness correlates","BASIC AND APPLIED ECOLOGY",2015,"2015-2016","yes","no","manter test, randomization, pearsons pair-wise correlations, GLMs, stepwise progression, analysis of deviance,","PC-ORD and R",2,"1","0","NA","no","no","NA","NA","NA","partially","yes","yes","no","no","NA","NA","AC, AB"
"Effect of habitat traits on tree structure and growth in private gardens","LANDSCAPE ECOLOGY",2015,"2015-2016","yes","no","cluster analysis, ordination analysis, Correspondence analysis","MS Excel and Multivariate Statistical Package (MVSP) and Canoco",3,"2","0","NA","no","no","NA","NA","NA","no","no","yes","no","no","NA","NA","AC, AB"
"Effect of the Relative Abundance of Conifers Versus Hardwoods on Soil delta C-13 Enrichment with Soil Depth in Eastern Canadian forests","ECOSYSTEMS",2015,"2015-2016","yes","no","BioSIM model (simluation based, for climatic variables), FORHYM and FORSTEM (for soil moisture and temp simluations), regression analysis, Pearson’s correlation tests, Backward stepwise multiple regressions","R",1,"0","0","NA","no","no","NA","NA","NA","yes","yes","yes","partially","yes","NA","NA","AC, AB"
"Effects of non-native Melilotus albus on pollination and reproduction in two boreal shrubs","OECOLOGIA",2015,"2015-2016","yes","no","non-parametric Wilcoxon rank sum test, MANOVA, ANOVA, multiple linear regression","SAS and R",2,"2","0","NA","no","no","NA","NA","NA","partially","yes","yes","no","no","NA","NA","AC, AB"
"Environment shapes invertebrate assemblage structure differences between volcanic spring-fed and runoff rivers in northern California","FRESHWATER SCIENCE",2016,"2015-2016","yes","no","regression, linear mixed effect model, Shapiro–Wilk tests, Welch t-test, nonmetric multidimensional scaling","R and PC-ORD",2,"1","5","3","no","no","NA","NA","NA","partially","yes","yes","no","no","supplements not OA","NA","AC, AST, AB"
"Environmental harshness shapes life-history variation in an Australian temporary pool breeding frog: a skeletochronological approach","OECOLOGIA",2015,"2015-2016","yes","no","cluster analysis, PCA, Fisher exact test, ANOVA, GLMM","R",1,"1","6","0","no","no","NA","NA","NA","yes","yes","yes","no","no","NA","NA","AC, AB"
"Epiphyte communities in Mediterranean fragmented forests: importance of the fragment size and the surrounding matrix","LANDSCAPE ECOLOGY",2016,"2015-2016","yes","no","specier area curve calulcations, GLMMs, GLMs","EstimateS and R",2,"2","1","0","no","no","NA","NA","NA","yes","yes","yes","partially","yes","reference of tha R package has unexisting version of the paclage (version 0.999999-2) so scored as no version provided. also calculated Simpsons diveristy index, and The Bray–Curtis similarity index ; some data available in supplementary word file","NA","AC, AB"
"Estimating sea-ice volume flux out of the Laptev Sea using multiple satellite observations","POLAR RESEARCH",2016,"2015-2016","yes","no","mathematical estimation of some variables, Uncertainty estimation, correlation analysis","Not Stated",NA,"NA","NA","NA","no","no","NA","NA","NA","NA","NA","yes","partially","yes","some data are available from online databaes, but probably difficult to extract exact data used.","NA","AC, AB"
"Evaluating habitat connectivity methodologies: a case study with endangered African wild dogs in South Africa","LANDSCAPE ECOLOGY",2016,"2015-2016","yes","no","Ecological niche model, current-flow analysis, least-cost paths, ANOVA","Maxent and Circuitscape and Linkage Mapper",3,"1","0","NA","no","no","NA","NA","NA","yes","yes","yes","no","no","NA","NA","AC, AB"
"Exploration is dependent on reproductive state, not social state, in a cooperatively breeding bird","BEHAVIORAL ECOLOGY",2016,"2015-2016","yes","no","GLMMs, Hierarchical generalized linear models","R",1,"1","2","2","no","no","NA","NA","NA","yes","yes","yes","no","no","very limited data can be red from Fig","NA","AC, AB"
"Exposure to sublethal concentrations of a pesticide or predator cues induces changes in brain architecture in larval amphibians","OECOLOGIA",2015,"2015-2016","yes","no","MANOVA, ANOVA, ANCOVA, PCA, Student–Newman–Keuls pairwise comparison test, bivariate Pearson correlations, Kruskal–Wallis test","Not Stated",NA,"NA","NA","NA","no","no","NA","NA","NA","NA","NA","yes","no","no","NA","NA","AC, AB"
"Extreme Climatic Event Triggers a Lake Regime Shift that Propagates Across Multiple Trophic Levels","ECOSYSTEMS",2016,"2015-2016","yes","no","estimation of values via math formulas, Modeling Ecosystem Responseto a Climatic Extreme,  hronological clustering (multivariate regression tree analysis), PCA, nonmetric multidimansional scaling","R",1,"1","3","3","no","no","NA","NA","NA","yes","yes","yes","no","no","NA","NA","AC, AB"
"Fear of the human super predator far exceeds the fear of large carnivores in a model mesocarnivore","BEHAVIORAL ECOLOGY",2016,"2015-2016","yes","no","repeated measures ANOVA, Dunnetts tests, normality and homogeniety of variance tests","Not Stated",NA,"NA","NA","NA","no","no","NA","NA","NA","NA","NA","yes","yes","yes","data at https://datadryad.org/stash/dataset/doi:10.5061/dryad.4g0m4","NA","AC, AB"
"Feeding damage to plants increases with plant size across 21 Brassicaceae species","OECOLOGIA",2015,"2015-2016","yes","no","linear mixed effects models","R",1,"1","3","3","no","no","NA","NA","NA","yes","yes","yes","no","no","very limited data from Fig","NA","AC, AB"
"Fire modulates climate change response of simulated aspen distribution across topoclimatic gradients in a semi-arid montane landscape","LANDSCAPE ECOLOGY",2015,"2015-2016","yes","no","simulations, linear regression","LANDIS-II",1,"0","1","1","no","no","NA","NA","NA","yes","yes","yes","partially","yes","some data might be possible to get from online databases, but unclear what exact data from these were used. the used software has extensions rather than packages. Do we code these? I did here","NA","AC, AB"
"Fish community responses and the temporal dynamics of recovery following river habitat restorations in Europe","FRESHWATER SCIENCE",2015,"2015-2016","yes","no","GLMs, Quantile regressions, Mantel test, permutations,  redundancy analysis","R",1,"1","0","NA","no","no","NA","NA","NA","yes","yes","yes","no","no","also calculated the Brillouin Index ; supplement non OA","NA","AC, AST, AB"
"Functional response of leaf- and planthoppers to modern fertilisation and irrigation of hay meadows","BASIC AND APPLIED ECOLOGY",2016,"2015-2016","yes","no","LMMs","R",1,"1","1","0","no","no","NA","NA","NA","yes","yes","yes","no","no","supplements not OA","NA","AC, AST, AB"
"Geographic divergence in upper thermal limits across insect life stages: does behavior matter?","OECOLOGIA",2016,"2015-2016","yes","no","nlme model, glm, Cox propor-tional hazards regression model","R",1,"1","2","2","no","no","NA","NA","NA","yes","yes","yes","no","no","NA","NA","AC, AB"
"Geographic variation in egg ejection rate by great tits across 2 continents","BEHAVIORAL ECOLOGY",2016,"2015-2016","yes","no","GLMs","JMP",1,"0","0","NA","no","no","NA","NA","NA","no","no","yes","partially","yes","limited data in supplements (word docs)","NA","AC, AB"
"Growth-defense tradeoffs for two major anti-herbivore traits of the common milkweed Asclepias syriaca","OIKOS",2015,"2015-2016","yes","no","asymptotic regression model, non-linear mixed effects models,  linear regression, generalized least-squares regression, linear mixed effects models","R",1,"0","1","1","no","no","NA","NA","NA","yes","yes","yes","no","no","graphical vector analysis, very limited data can be read from supplementary Figs","NA","AC, AB"
"Hatching hierarchy but not egg-related effects governs behavioral phenotypes in gull chicks","BEHAVIORAL ECOLOGY",2016,"2015-2016","yes","yes","U Mann–Whitney test, ANOVA, GLMs, failure-time model","SAS",1,"1","0","NA","no","no","NA","NA","NA","no","no","yes","no","no","NA","NA","AC, AB"
"Herbivore-induced changes in flower scent and morphology affect the structure of flower-visitor networks but not plant reproduction","OIKOS",2016,"2015-2016","yes","no","post hoc Tukey HSD tests, ANOVA, Kruskal–Wallis ANOVA, GLMs, non-metric multi dimensional scaling, Wilcoxon rank-sum tests, paird t-test","R",1,"1","1","1","no","no","NA","NA","NA","yes","yes","yes","yes","yes","data at ttp://dx.doi.org/10.5061/dryad.p1208","NA","AC, AB"
"Heterozygosity, gender, and the growth-defense trade-off in quaking aspen","OECOLOGIA",2016,"2015-2016","yes","yes","LME, ANOVA, likelihood ratio testing, non-linear mixed-effect model, third-order autoregressive proces","R",1,"0","0","NA","no","no","NA","NA","NA","yes","yes","yes","no","no","NA","NA","AC, AB"
"Highly unsaturated fatty acids in nature: what we know and what we need to learn","OIKOS",2016,"2015-2016","yes","no","Descriptive statistics (box plots)","Not Stated",NA,"NA","NA","NA","no","no","NA","NA","NA","NA","NA","yes","yes","yes","data at https://datadryad.org/stash/dataset/doi:10.5061/dryad.67dg6","NA","MP, AB"
"Highway to heaven? Roadsides as preferred habitat for two narrowly endemic crayfish","FRESHWATER SCIENCE",2016,"2015-2016","yes","no","GL Mixed Models","R",1,"1","4","1","no","no","NA","NA","NA","yes","yes","yes","no","no","could not open supplements (not OA)","NA","MP, AB"
